Id,Text,Text_en,Text_ja,ChoiceText1,ChoiceText1_en,ChoiceText1_ja,ChoiceText2,ChoiceText2_en,ChoiceText2_ja,Notification,Notification_en,Notification_ja
对话Id,对话正文,,,选项1文本,,,,,,,,
1,别走神，已经开始战斗了……这次的敌人比较弱小，正好可以熟悉一下您的指挥风格。,"Don't lose focus, the battle has already begun... This enemy is relatively weak, a good chance to get familiar with your command style.",気を抜かないで、もう戦闘は始まってるよ……今回の敵は比較的弱いから、あなたの指揮スタイルに慣れるのにちょうどいいね。,,,,,,,,,
2,是否查阅战斗教程？,Do you want to view the combat tutorial?,戦闘チュートリアルを見ますか？,是,Yes,はい,否,No,いいえ,,,
*3,下方是魔女的行动牌，到魔女的回合时才能使用。你可以通过打出行动牌去指挥魔女进行行动，对局面造成影响。,"Below are the Witch's action cards, which can only be used during the Witch's turn. You can command the Witch by playing these action cards to influence the situation.",下にあるのが魔女の行動カードで、魔女のターンにしか使えないよ。行動カードを使って魔女に指示を出し、戦況に影響を与えることができるんだ。,,,,,,,,,
4,回合开始时，你可以抽取4张行动牌。你可以在左下角检阅抽牌堆，里面是你即将抽到的牌。一旦你打出非燃烬牌，它会进入右下角的弃牌堆中，当抽牌堆清空时，弃牌堆的牌会被打乱重新洗入抽牌堆。,"At the start of your turn, you draw 4 action cards. You can inspect your draw pile in the bottom left corner to see the cards you're about to draw. Once you play a non-Burn card, it goes into the discard pile in the bottom right. When the draw pile is empty, the discard pile will be shuffled back into the draw pile.",ターン開始時、行動カードを4枚引くことができる。左下の山札を確認すれば、次に引くカードを見ることができるよ。燃焼しないカードを使用すると、右下の捨て札に送られる。山札がなくなると、捨て札がシャッフルされて新しい山札になるんだ。,,,,,,,,,
5,左侧魔能是行动牌使用时会消耗的资源，回合开始时会自然恢复，魔能有6点的上限,"The Mana on the left is the resource consumed when playing action cards. It restores naturally at the start of your turn, and has a cap of 6 points.",左側にある魔力は、行動カードを使う時に消費するリソースだよ。ターン開始時に自然に回復して、上限は6ポイントだ。,,,,,,,,,
6,你可以将鼠标移动至对象身上与意图上获取关键信息,You can hover your mouse over characters and their intents to get key information.,キャラクターやインテントにマウスカーソルを合わせると、重要な情報を得ることができるよ。,,,,,,,,,
7,击杀所有敌人即可取得胜利，如果你感觉到局勢不妙可以通过右下角的按钮重新开始这一次战斗,"Defeat all enemies to achieve victory. If you feel the situation is unfavorable, you can restart this battle using the button in the bottom right corner.",全ての敵を倒せば勝利だ。もし戦況が不利だと感じたら、右下のボタンでこの戦闘をやり直すことができるよ。,,,,,,,,,